{
  "slug": "name-change-sealing-tx",
  "jurisdiction": { "country": "us", "region": "TX" },
  "class": "court-record",
  "exposesDeadnameRisk": "high",
  "permanence": "high",
  "whatItIs": "In Texas, an adult name change is a public court record that links your former and current name. Texas lets certain people at risk — including victims of family violence, sexual assault, stalking, or human trafficking — ask the court to keep the file confidential.",
  "actions": [
    "If you have a qualifying safety history, ask the court for a confidential name change when you file — a legal-aid or LGBTQ legal org can help you show that you qualify.",
    "If your order is already public, ask the clerk what options exist to restrict access after the fact.",
    "Then suppress the downstream copies: broker opt-outs, Google 'Results about you', and the web-archive and search-cache removals."
  ],
  "sealedPetitionAvailable": true,
  "disclaimer": "Informational only — not legal advice, and not yet reviewed by a lawyer. Texas practice varies by county and judge and changes over time; verify with the court or a legal-aid org before filing.",
  "lastVerified": "2026-06-01"
}
