{
  "slug": "name-change-sealing-wa",
  "jurisdiction": { "country": "us", "region": "WA" },
  "class": "court-record",
  "exposesDeadnameRisk": "high",
  "permanence": "high",
  "whatItIs": "In Washington, a name change is ordered by the court and becomes a public record. Washington lets you ask the court to seal the name-change record for personal safety, and its Address Confidentiality Program (run by the Secretary of State) can let qualifying participants change their name confidentially.",
  "actions": [
    "When you file, ask the court to seal the name-change record on safety grounds; if you're a survivor of domestic violence, stalking, or trafficking, ask about Washington's Address Confidentiality Program, which supports a confidential name change.",
    "If your order is already public, ask the clerk about sealing it after the fact.",
    "Then suppress the downstream copies: broker opt-outs, Google 'Results about you', and the web-archive and search-cache removals."
  ],
  "sealedPetitionAvailable": true,
  "disclaimer": "Informational only — not legal advice, and not yet reviewed by a lawyer. Washington sealing practice and ACP eligibility vary and change over time; verify with the court, the Secretary of State, or a legal-aid org before filing.",
  "lastVerified": "2026-06-01"
}
