{
  "slug": "name-change-sealing-pa",
  "jurisdiction": { "country": "us", "region": "PA" },
  "class": "court-record",
  "exposesDeadnameRisk": "high",
  "permanence": "high",
  "whatItIs": "In Pennsylvania, a name change normally requires publishing notice and is a public court record. A court can waive the publication requirement and seal the record where publication would put the petitioner's safety at risk.",
  "actions": [
    "When you file, ask the court to waive publication and seal the record on personal-safety grounds — a legal-aid or LGBTQ legal org can help you make the case.",
    "If your order is already public, ask the clerk about sealing it after the fact.",
    "Then suppress the downstream copies: broker opt-outs, Google 'Results about you', and the web-archive and search-cache removals."
  ],
  "sealedPetitionAvailable": true,
  "disclaimer": "Informational only — not legal advice, and not yet reviewed by a lawyer. Pennsylvania practice varies by county and judge and changes over time; verify with the court or a legal-aid org before filing.",
  "lastVerified": "2026-06-01"
}
